review,aspect,aspect_encoded
"the movie was boring', 'there was no point in the movie where i said thats interesting', 'it made it look like anything in his life he did was very easy', 'there was no struggle', 'made jail look easy, selling drugs, and even rapping', ""it wasn't realistic""",Story,2
"""It's also in widescreen which helps, it gives a feeling of a real motion picture""",Cinematography,0
"Jordan Christopher-Michael is a brilliant young actor!', 'He interprets very well his character Gus on the movie.', 'Gus loses an eye, got tattoos and go at the most weird cities acting with Flea, Drew Barrymore and Meat Loaf!",Characters,1
"the entire audience gasped', 'wonderful scene-fades', 'creative camera angles', 'Mamoulian just keeps exploring the directorial medium and coming up with innovation",Cinematography,0
"the production quality is poor', 'the set area never takes on the look or feel of uber-coldness one might expect', ""it's okay that the set area never takes on the look or feel of uber-coldness""",Cinematography,0
"This movie packs a lot of story into a very short time.', 'I found the intricately woven plot to be believable and interesting.', 'the idea so much (of a wayward married man brought to redemption through trials and tribulation)",Story,2
the scenery and special effects are incredible -- the best,Cinematography,0
"Roy Scheider and Maria Conchita Alonzo do well by their roles', 'Other performances are dismissable', 'A pretty Oriental woman in a short tight skirt who totes a gun', 'Whoever plays the surviving Secret Service agent aboard the cruise ship",Characters,1
"Horses play a role in this show due to Madonna falling off one', 'at the end a website address comes up for anyone interested in donating",Story,2
The entire film is very well shot,Cinematography,0
"The plot is very easy to understand.', 'To be straight forward they find this cave. They go in the cave. They get stuck in the cave.', ""It doesn't even try to be original."", 'it also seems only Americans can survive the terror.",Story,2
"This is one of those movies.', 'It not only attacks humans, but it eats their intestines and has a bulletproof, nearly indestructible constitution.', ""How can a hypodermic needle penetrate its skin when bullets can't?"", 'Why, when the marines figure out that armor-piercing bullets can hurt it, do they split up so the chupacabra can pick them off one by one?",Story,2
"This movie always leaves me in tears.', 'The end could not be better.', ""I'm excited for The Phantom Menace because it will suddenly throw the focus of the whole story from Luke to Anakin."", 'I love how he is revealed at the end - it would be too unresolved any other way.', ""It's very effective.""",Story,2
"the college he works at wants to pull the plug on his project', 'he tries it on himself', 'an incredibly long transformation sequence that takes nearly 3/4 of the movie', ""the ending really doesn't make any sense"", 'a lack of a good payoff",Story,2
"""It's shot in a clear and crisp black and white"", 'edited and captured in a low-key yet spry and small-scale approach",Cinematography,0
"""“the killing scenes were really well done”, “the best had to be when he shoved the cell phone down the Blonde Girl's mouth”],""",Cinematography,0
"The main idea of the movie is travel into past lives which - fortunately - is not a time travel but a journey inside man which has nothing to do with the past or the future.', ""Maybe they shouldn't be called past lives at all in the film now that I think of it."", 'I believe the idea needed a little more thought, developing and unfoldment.",Story,2
"the storyline takes a really interesting twist', 'it goes from being a cliché melodrama to something entirely different, and far more entertaining than I had initially thought ],",Story,2
"Much of the photography of the countryside was beautiful, an obvious attempt at contrast with the grimy city settings.",Cinematography,0
"""although there is some good acting on the part of most you don't get into there heads especially mecbeths."", 'the best performance came from gary sweet and the strangest mick molly.",Characters,1
"""A lot of effort has been put to make 'The Edge of Love' look the right period."", 'the tone of the colours.', 'Most of the first half of the film is processed so much to have a strong bluish tone.', 'Another detrimental point is the fancy use of image splitting lens.', 'There are many scenes that have three or four images of the same thing.",Cinematography,0
"The parents in this show are nearly as irresponsible as the children.', ""This show tells the already manipulative preteens that watch it that the 'divide and conquer' technique is the best way to get their parents to 'cave.'""",Story,2
"the story is about a small town half full with Mormons and half full with Baptists', 'sends a very pro-Mormon, and sort of anti-every other religion message",Story,2
"Scenes in car and scenes in the mountains are breathtaking.', 'it was one of the first Warner like cinemas cope features, process called Warnerscope which gave a very neat cinematography.",Cinematography,0
"I also got a big kick of the Chapter Titles appearing before the chapters, especially the ones that introduce the characters as they appear on screen.",Characters,1
"the story is inane', 'the monster has no real motive for attacking civilization', ""the plan that eventually halts Gamera's rampage is completely phony and ridiculous""",Story,2
"the introduction, where John Berlin (Andy Garcia) is driving into town', ""You see his Mercedes pass on a winding road through a forest that looks like its loaded with Redwood trees. It's quite beautiful.""",Cinematography,0
"a refreshing exploitation epic for Generation-X', 'Tromeo And Juliet is the definitive edition of a rather lackluster story', ""Like in the original, there is a confusing situation, leading to Tromeo falling for Cap's daughter"", 'young lovers feel that eloping would be the best decision",Story,2
"fine lead actor, and i always like Fairuza Balk",Characters,1
"""There are some really cool shots of Harryhausen's miniatures interacting with people and horses.""",Cinematography,0
"""The cinematography was hideous, consisting of disjointed framing and some of the oddest lighting I've witnessed.""",Cinematography,0
"the shotting style was rather bland at times', 'I think it helped make the story more realistic and keep the focus on the person",Cinematography,0
"awfully cramped and claustrophobic feature', ""it feels like everyone is hunkered close together so the camera won't have to pull too far back""",Cinematography,0
"Chief Inspector Sir John. I know the guy was meant to be comic relief, but his buffoonish character has way too much screen time. ],",Characters,1
Pauly Shore has a small role which does not allow him to be as fully obnoxious as one would expect,Characters,1
"the writing is only fair', 'I really expected something more substantial in the terms of action, or plot but I got very little', 'the finale was not big enough', 'I just thought it could have ended with a little more of a bang",Story,2
"the whole thing is nearly destroyed by the rushed, sugary ending",Story,2
"Boyer is Luis Denard, a well-known concert pianist', 'Wanda Hendrix is the drudge of a girl (Else) who works for Mrs. Melendez', 'the villains are likewise also losers - frequently with their lives",Characters,1
"clever plot twists and believable character development', 'Consider this a Sports Illustrated shoot whose character goes around killing people",Story,2
"The look and feel is a lot different from many movies ],",Cinematography,0
"There are no characters in the film, but much too many plot lines - all underdeveloped and mostly superfluous.', ""Two plot lines really showed some promise (the love story and the 'company' story), but failed""",Story,2
"""weird little story about a hood's girl who finds that her past will always be with her"", ""this attempt to bring the woman's viewpoint into the genre as a tearjerker doesn't work""",Story,2
"""I couldn't believe some of the horrible dialog coming out of people's mouths."", ""It was pretty funny watching this little 'creature' in a black reptile suit with what looks like large beetle shells attached to it, running around in the dark."", ""A snake that also comes out of the container that gets hammered to death by William Fair, after the mini creature chews into Frank McDonald's neck in the kitchen.""",Characters,1
"the idea behind the film is a very good one', 'A German plastic surgeon (Bela Lugosi) was hired by the Japanese to operate on several Japanese agents and turn them into the likenesses of upstanding American businessmen', 'he was betrayed by the Japanese and thrown into prison', 'he later escapes and travels to America to seek revenge on his patients through a series of highly-publicized murders",Story,2
"this is a murder mystery/ psychological horror/suspense movie', 'the movie also has one great twist in it', 'the film also has a strong moral to it",Story,2
The acting is stock.,Characters,1
"what appalled me the most is Richard Kelly (director of Donnie Darko) did the screenplay to this.', 'terrible story and look of it.', 'all in all this film is bad.",Story,2
"my only satisfactions in this movie were observing the very attractive Jonathon Tucker, playing Jeff McIntire, grow increasingly more frazzled and distressed', 'almost all of the cast dies a horrible, gruesome death",Characters,1
"This story is about when Lisa, Snoodle, Doodle go to the Big Rock Candy Mountains.",Story,2
"this voice without a face, this unknown and threatening voice works really well in the film",Characters,1
Why are the camera angles so bad in general?,Cinematography,0
"the start of the movie sees two women (Heather Graham and Natasha Gregson Wagner)', 'Natasha Gregson Wagner is a lovely looking actress, and she plays Louise', ""he is, basically, a mummy's boy"", 'Robert Downey Jnr is one of the many things that is wasted in the film",Characters,1
The cinematography was certainly different exposing the stage aspect of the set and story.,Cinematography,0
"the way it was filmed, with the many camera cuts",Cinematography,0
"""Though i must agree that the college years aren't as good as her high school years, but that doesn't mean they weren't still good."", 'I think the ending was awesome although it was not what i hoped, it made sense and i loved it anyways.",Story,2
"Jason Lee has huge potential', 'Julia Stiles and Selma Blair are hot",Characters,1
"Jolly old Nicholas Hammond, of The sound of music fame, is brought to the TV screen as peter parker', 'peter deals with a clone, a beautiful girl from a foreign country, and a corrupt politician', ""it's also slightly disappointing that Robert. F Simon looks nothing like J.J.Jameson"", ""Betty grant isn't Betty grant, but a hot African American girl""",Characters,1
The main characters are an annoying dinosaur klutz and Whoopi Goldberg,Characters,1
"While Wayne is another victim of the distant framing in dialogue scenes, we do at least see his strong physical presence and hear his warm but assertive vocal delivery', 'He betrays his lack of experience, but the potential is clearly there', ""Also appearing in this picture is Wayne's buddy (and later prolific character actor) Ward Bond""",Characters,1
"stock characters (given some depth in fun performances by John Cusack, Joan Cusack, Marisa Tomei and Hillary Duff)', ""Cusack's character (the hit-man with a heart) tries to change his life..."", ""the do-gooder journalist who doesn't trust him (Tomei)"", 'the young Middle Eastern starlet who wants to call off her marriage (Duff)', ""Cusack's sister, Joan, plays his assistant with an almost cartoonishly enthusiastic quality."", 'Ben Kingsley seemed to me wasted in his smaller part as a ruthless CIA boss.",Characters,1
Harry had an amazing life and one of the best and distinct voices ever recorded.,Story,2
"This movie was so badly written, directed and acted that it beggars belief.",Story,2
"the unique quality of its filming', ""the most impressive element, however, is how perfectly life aboard a man-of-war en route to Australia in the early 1800's is presented""",Cinematography,0
"Guy sees interesting woman in lobby.', 'Manages to stay there and watch her under the guise of waiting for the building supervisor.', 'Guy says nothing.', 'Woman looks frightened or at least slightly disturbed.', 'Guy wanders off to bed.",Characters,1
"minimal cast', 'Dr and Rose', 'the characters start being picked off one by one",Characters,1
"the film differs from the book only in some small ways', 'it is wonderful and inspiring to watch",Story,2
characteristic lighting,Cinematography,0
"The movie seems torn between fluff and depth', 'Against the backdrop of nice, supportive Israelis and surly homophobic Palestinians we move to a resolution that is utterly lacking in motivation or purpose",Story,2
"""“The highlights of the movie are the characters and their interactions.”, “Unlike 'Holloween' (2007) we got to meet the people and care what happened to them.”, “Ben (Joel Moore, who is also the lead of 'Spiral') the sulking lead and Marcus ('Not Another Teen Movie') as the best friend and funny man to root for during the movie.”, “Shapiro (Joel Murry 'Dharma & Greg'), Jenna (Joleigh Fioreavanti) and Misty (Mercedes McNab of 'Buffy the Vampire Slayer: The Series', 'Angel: The Series' and 'The Addams Family' movies) give a convoluted reason for topless women.”, “Mr. and Mrs. Permatteo played by television regulars (Richard Riehle 'Grounded for Life', Patrika Darbo 'Step by Step') as the older couple that you know don't stand a chance, even the tour guide Shawn (Parry Shen) is a fleshed out character.”],""",Characters,1
a bunch of one-dimensional characters,Characters,1
"Zentropa is a bit disjointed in this respect', ""But I'd have to say that The Third Man has a more well-crafted storyline"", 'it is presented as a dream/nightmare, and making it too coherent would spoil the effect",Story,2
"rubbish lighting', 'grainy visuals",Cinematography,0
boring camera work,Cinematography,0
Boringly directed by William Marsh in over-saturated hues,Cinematography,0
"the opening scene consisting solely of murky intergalactic visuals', 'more murky stuff', 'many murky close-ups of an old lady', 'the movie seemed to be in some kind of loop for a while here",Cinematography,0
"The script is excellent, the story-line non-linear but easy enough to follow.",Story,2
"Jacqueline Lovell introduces a couple of her own movie scenes', 'a Polish woman who seems to have no interest in acting",Characters,1
nicely shot,Cinematography,0
"Every performance is absolutely perfect.', 'Bill Nighy has been justly complimented for his portrayal of Ray, a man who has had one too many bad trips.', 'Stephen Rea is perfect as Tony, the lovable keyboard player who has carried a torch for Karen all these years.",Characters,1
"obviously shot on video tape', 'very poorly at that",Cinematography,0
"it is humorous how bad it is', ""i've seen porno's with a better plot""",Story,2
"Everything that is seen or heard on the screen is intentionally crafted to evoke a feeling, sensation or tone.', 'The clarity of certain visuals and the crispness of certain sounds are deliberately contrasted with blurred images.",Cinematography,0
"the actors delivered up to standard', 'only one character who was nice to the girl', 'the boyfriend and the neighbor?",Characters,1
"Tony Randall works for the IRS', 'They dote on him and treat him like one of the family', 'plans on getting him hitched to their daughter, Debbie Reynolds",Characters,1
