review,aspect,aspect_encoded
"the cast is excellent', ""this is Bette Davis's first great role and one of Leslie Howard's best performances"", ""Howard's Carey is naive and vulnerable"", 'Mildred is unrestrainedly wicked, a user of the worst kind",Characters,1
"""very bad adaption of one of King's best short stories"", 'in the original story King managed to create tension and draw personality of his characters', 'all that is left is a repetitive bore which is far too predictable to be all that suspenseful', 'the effective ending used in the story is in favor dumped for a happy ending which makes the overall impact mute",Story,2
"""the camera's eye was shocking, but experimental"", 'famous lighting, blocking and angles we know', 'the manipulation of Black Irish ... was neither: a force of human conspiracy ... nor of nature",Cinematography,0
"This movie could have been so much better with a script rewrite.', ""Not that I expect a great deal of plausibility in movies, but you'd think that even the homeless and urban-dwelling Jack Mason would question why a group of experienced hunters would want to hire him as a hunting guide."", 'And how does Jack Mason find Thomas Burns back in Seattle?', ""I'm assuming this movie was based on Richard Connell's short story 'The Most Dangerous Game.'""",Story,2
"""the film isn't bad, actually it's better then your usual straight to video I would say."", 'Very slick stuff.', 'some inventive and prominent camera angles",Cinematography,0
"the film has a stellar cast that include Matt Dillon, Jean Reno and Lawrence Fishburne.', 'Its a first rate cast that sells and covers over the stories short comings.",Characters,1
"Amanda B. did a great job as the main role', 'Channing Tatum looks too good to be true as her opposite as the gorgeous Duke",Characters,1
The cinematography is not bad but it looks like it was cut with a machete.,Cinematography,0
"This is a very good story for anyone, young or old, who has ever been in love, or ever wanted to be",Story,2
"""The antagonist characters in the story start out as genuine, real human beings and then slowly progress into 'stereotypical, objectifiable forces of evil' by the very end""",Characters,1
"""The synopsis didn't really tell you much."", 'In parts it was silly, touching and in others some parts were down right hysterical.', ""If you like any of the actors give it a watch but don't look for anything too dramatic it's good fun.""",Story,2
"The story compelling', 'I really wish the ending had been handled differently', 'some sort of an epilogue would have been nice",Story,2
this movie is perhaps more like a love story,Story,2
"""Jack Nicholson's performance is also one of his very best, scaring the hell out of me and making me sure to get out once in awhile.""",Characters,1
wonderful cinematography,Cinematography,0
"the acting and the not-so special effects were nowhere near the standard', 'what is with the men dressed up as women, could they not find any women",Characters,1
"""Zeenat Aman as Dev's sister made a tremendous impact."", 'Dev grows up to be a pilot and he learns that Jasbir is in Kathmandu with certain hippies.', 'Janice who in reality is Jasbir with a new name and new identity.",Characters,1
"""you just can't find any meaning"", ""the two awful scenes where directly connected to war and it's horrors""",Story,2
"Duke, of course plays the hero', 'He had not yet developed his on screen character', ""Also cast in the film were George (pre-Gabby) Hayes as the heroine's father, Cecilia Parker as the heroine and Yakima Canutt as 'one of the boys'""",Characters,1
"The camera frequently goes out of focus', 'the constant panning in some of the over long scenes is annoying",Cinematography,0
"the worst failure is in story', 'There is precious little beyond a short', 'we saw variations of the same scene over and over again",Story,2
"the only intention of this movie seems to be showing love in many different ways', 'each story has only a few minutes, so there is no development of characters and nearly no plot', 'just a sketchy idea of a plot', 'the writer tried to build in turning points that aimed to surprise the viewer', ""that just didn't work out because you didn't get to know the characters in before""",Story,2
"This film could have been a decent re-make', ""What worked in this film in the 1930s doesn't translate to the 2000s""",Story,2
As for the other characters. There is this guy who talks with his mind instead of his voice and this blue alien. The alien guy talks with a deep voice.,Characters,1
"""It's very splashy, with a lot of hey-ma-look-at-this camera work that calls attention to itself, instead of serving to advance the story.""",Cinematography,0
"its cinematography is genius', 'black and white cinematography, suggests us an even more depressed view of the world after the holocaust",Cinematography,0
"the two main characters disability, this was represented in a great performance by both two Michael and Rory', 'theses two certainly made great use as their gifted talent to portray a masterpiece piece of drama",Characters,1
"I was amused, however, by the opening shots of horses having sex in a public square. ],",Cinematography,0
"The film is a blend of pure atmospherics and visceral horror.', ""Bringing in Rob Bottin of The Howling fame, he lays to bear some of the most astonishing transformation effects you'll ever see in a horror film.""",Cinematography,0
"""The script does not contain a single funny line which is rather in the way when you're trying to entertain your audience with humour."", 'the constant continuity errors and bumbling along of the story - if you can find one.",Story,2
"The only character I found still very amusing was the Queen', 'The Queen, she was very funny in this movie and had the best part', 'the voice changes, they were noticeable and also bothered me quite a bit",Characters,1
"chock-full of all the various high-school stereotypes', 'Emily Bergl is as frightening as a cabbage patch doll', ""Jack London... let's just say i didn't pay to see wood act"", 'even the actors look like they were forced into doing this movie",Characters,1
"The two romantic leads, Steve McQueen and Aneta Corsaut, bring surprising depth and sentimentality to the proceedings.', ""Steve McQueen's drag-racing rival almost appears to be an enemy early on in the proceedings, but quickly joins in McQueen's campaign to save the town.""",Characters,1
"the somewhat dim black and white filming only enhances this', 'lingering shots, something most modern day directors do not have the patience for",Cinematography,0
some pretty decent visual effects,Cinematography,0
"Rachel McAdams is wonderful as always.', 'Cillian Murphy is creepier than he was in Batman Begins.', 'Cillian Murphy is really good at being bad.",Characters,1
"the central character, Danny', 'unappealing young man', 'the highly vulnerable and defenceless young woman', 'the doctor entirely careless of any notion of professional ethics",Characters,1
"About the effect of racism on an already fraught relationship between two black men and their sister, two of whom pass for white', 'Plot was minimal, mood and emotional apparent truth were everything",Story,2
"The littlest kids in the short are among the cutest to have ever been on film', ""I honestly can't think of a cuter kid than Spanky at about age four"", 'placing the little tiny boy in charge of babysitting the even younger kids was not only funny, but once again high on the cute factor",Characters,1
"""the movie isn't the Rose!"", 'it was really excellent for its limited budget', ""the portrayal of the Britain of the early 80's, exploding with rebellious youth, looking for a way out of the dole queue""",Story,2
"impressive pictures being filmed under water, in the air or the Arctic",Cinematography,0
"deeper characterisation', ""such as Brian Epstein trying to hide the fact that he has been 'queer-bashed,' only to find out that the band knew he was Gay all along."", ""My favourite scene, which does have some basis in fact, is where at an audition Stuart Sutcliffe has just bought his bass guitar but can't play it, so he stands with his back to the impresario and tries faking it, but gets caught.""",Characters,1
"both Leo Gorcey and Huntz Hall would have better moments', 'the best of which tend to come here when they ad-lib",Characters,1
"strange feeling of watching some 70s TV series, due to the filter and the musical score",Cinematography,0
"The animation is stunning.', 'Very artistic, odd and dark.",Cinematography,0
"The three unknown actors do a great job with pretty demanding roles', 'the characters act realistically in the situation and the dialogue seems natural and not forced",Characters,1
"""The clever thought-provoking way of sending violence back into the audience's face.""",Story,2
I never thought anything as mundane as the simple sale of a music box could leave me catching my breath with excitement.,Story,2
"Let me begin by expressing my admiration for a perfect portrayal by Reese Witherspoon.', 'That her performance stands out in the excellent cast is praise indeed.",Characters,1
"The characters are quirky and feel like real people', 'you may even find endearing as I did",Characters,1
The restored version I viewed used tinting to increase the spooky atmosphere.,Cinematography,0
"Each show is an adventure', 'the Doodlebops do not try to change the world with preachy messages all they do is have fun while sorting out everyday life challenges that the young child may relate to",Story,2
"my dad kept wanting to talk about himself and things in his life he feels he screwed up', 'my dad is not a reticent man, but I was surprised that he wanted to talk about mistakes he thinks he made.",Characters,1
"each characters', 'nice characters and performs', 'hoped more definitions about characters stories",Characters,1
Watching a young Combs at work is great but I wish he had had more lines.,Characters,1
"This movie has about as much entertainment value as getting a root canal.', 'It approaches the abyssmal depths of bad movie making, and then gets even worse.",Story,2
"“Jane Fonda does one Hell of a fine job”, “DeNiro is his usual superb self”],",Characters,1
"""the characters don't show any feelings toward each other""",Characters,1
considerably more real-time footage of blimps etc.,Cinematography,0
"terrible filming and MTV like style', 'slow rain drop shots",Cinematography,0
"Great acting', 'Vincent Ventresca', 'made Thomas character very attractive",Characters,1
"much of it was filmed in my home town of Regina, Saskatchewan",Cinematography,0
The film has the visuals,Cinematography,0
"that guy is older than 50 and so far he almost only played in mediocre TV series', 'he is the living proof of what a great caster Tarrantino is",Characters,1
"None],",Cinematography,0
"""the strange premise, that somehow, having survived the tornado and being apparently incapable of happiness, these people are lucky, and yet don't know quite what to do with their luck""",Story,2
"the story soon descends into a bizarre sexual fever-dream', 'I am intentionally not giving a full description of the most important parts of the plot as they simply have to be seen to be believed",Story,2
the editing in this film did a very good job of making her dancing look not only natural but beautiful,Cinematography,0
"The camera work is out of focus at times and always shaky.', 'It looks as if it was shot on video.",Cinematography,0
"A straight-forward X File that shows that action is always the equal of intelligence', ""it's a standalone X File that even non-fans could happen upon and enjoy""",Story,2
"Only Cross of Iron beats this for tension and story.', 'This is one of the best war films ever.",Story,2
"Douglas and Blondell were both very talented and attractive people who usually delivered, even when the material was not the greatest.",Characters,1
"the plot may not be entirely unique', 'the movie has enough charm to make sure you keep watching.', 'ensure the audience is behind their almost impossible quest to reach the end of the world and destroy the dragon",Story,2
I loved the way this film was shot.,Cinematography,0
"Anthony Minghella made an absolutely stunning film', 'through his camera he manages to create unbelievable emotions inside you",Cinematography,0
"excellent photography', 'Stylish visual direction",Cinematography,0
I had not followed the non-existing plot at all,Story,2
"This was not enjoyable to watch.', ""Frank puts all his dreams on the back burner and gets a normal (boring!) job just so his stepson can go to film school, but his stepson decides that he'll make a humiliating documentary about the man instead."", 'The goal seems to be to make Frank appear dumb and pathetic, instead he comes across as the most human of the 3 people featured.', 'Essentially a smear campaign all dressed up as something much smarter and edgier than it really is.",Story,2
"Fleischer and cinematographer Richard H. Kline do a great job of filling the screen with interesting images and sounds', 'The use of soft, dimly lit visuals, murkily filtered, add a Stygian feel to the New York of the film",Cinematography,0
"cast led by someone besides the totally miscast and talentless Judd Nelson', 'Bill Paxton fan but he was fun to watch",Characters,1
"Ella Raines is good in the female lead role and Thomas Gomez makes a likable policeman.', 'Alan Curtis started well as the confused, innocent man, but once he is arrested his performance took a left turn as he became thoroughly unpleasant to Kansas for no reason.', 'God knows why she stuck by him.",Characters,1
she looks like she´s making a fashion magazine cover in all the shots,Cinematography,0
The acting was terrible,Characters,1
"""judge Jean Luis' (Jean-Louis Trintignant) and Valentine Dussaut (Irene Jacob)"", 'a generational conflict between the experience of a world-weary old man and the self-conscious immaturity of a nice girl', 'a spiritless misanthropist and a spontaneous girl full of good sense of unselfishness",Characters,1
"great performances by Kurt Russell and, especially, Robin Williams', ""in a brilliant manic nerd turn that's different from any of his other work""",Characters,1
"I can only describe the camera work as frenetic meets LSD.', 'there are whole segments, minutes long, where all you can see are blurred flashes and fragments of cave wall', 'the EXACT same footage of blood on the cave floor is used twice in about 90 seconds.",Cinematography,0
"The script was dreadful enough', 'how did such a bad script get the green light?",Story,2
"the film that made her a breakout star', 'Gloria plays the wife of a rich slob that continually takes her for granted', 'a Lothario comes into their lives', 'ultimately, she divorces her hubby and marries the smooth-talking Romeo', 'while the movie could have just been an overdone melodrama, it takes some interesting twists and turns and is an imaginative and fun film', 'it is a standout and deserves to be remembered",Story,2
"there are two story lines wildly different in both tone and content', 'frothy romantic comedy and a searing tragedy', 'the decision falls in the favour of Shylock",Story,2
"""Full of TV actors/actresses of 70's/80's/90's""",Characters,1
"There needs to be a likable hero or heroine.', ""This film doesn't have one."", 'The person I most identified with was the head detective.",Characters,1
"if I feel sorry for anybody in this film its decent actor Drake Bell who is put through an immense amount of embarrassment.', 'Rick Riker (Drake Bell)', 'Lou Landers (Christopher McDonald)', 'the villainous Hourglass', 'superhero needs a nemesis",Characters,1
the leads and supporting actors are in fine form and you can only feel sympathetic for their predicament especially in the final scenes.,Characters,1
nice architectural photography in the film,Cinematography,0
"This film deserves 100% for cinematography for its opening sequence.', 'The opening shot is stunning and I have not yet figured out how they did it.', 'The movie is worth watching for that shot alone!",Cinematography,0
"Matt Damon is talented and versatile', 'was just meant to play Jason Bourne', 'fully understand the character Jason Bourne and become attached and be a part of his world",Characters,1
"The highlight of the film is obviously the lengthy ballet at the end of the film based on the title music with sets and costumes in the styles of the great French Impressionist painters.', 'the DVD is well-done with fine clear graphics (when they are supposed to be)",Cinematography,0
There is some very nice scenery,Cinematography,0
"It is not, not under any form of narcotic or brain damage.', ""Having the kid fly planes into a skyscraper would've been more appropriate.""",Story,2
"Felix', 'a guy whose shoe business is folding', ""Felix's owner"", 'Ben Turpin', 'Charlie Chaplin",Characters,1
"The voyage to the New World is shot almost in complete darkness', 'The most powerful image in the film was when the ship is leaving their homeland and setting sail for the New World', 'This shot shows an overhead view of a crowd of people who slowly seem to separate from one another', 'Once they arrived in the Americas, they had to go through rather humiliating tests",Cinematography,0
"the stunning look of this film', 'one of the most beautifully photographed and designed movies', 'veteran cameraman Conrad Hall will very likely win another Oscar for his work here', 'dramatic use of red blood splattered against pale colored walls', ""preponderance of blacks, blues and grays that dominate the movie's color scheme""",Cinematography,0
"the story of Tony Montana well thanks to the superb screenplay by Oliver Stone', 'this is a film about the darker side of the American dream', 'Tony finds himself coming to America, getting it all, living the American dream and then losing it all in violent fashion",Story,2
"""The film's design seems to be the alpha and omega of some of the major issues in this country (U.S.)."", 'But what the film adds to its value is its other relationships: male v.s. female, white v.s. black, and the individual v.s. society.', 'Higher Learning gets its name in showing college as more than going to class and getting a piece of paper.",Story,2
"""silly story line that reads from a five year old's comic book"", ""the ending left it open for further rehashing of the same effects in 'People that Time Forgot'""",Story,2
The visuals range from fairly good to plain boring.,Cinematography,0
"""Wynorski's movie centres on a group of cheerleaders who, along with their teacher, mini-bus driver and a couple of guys, become stranded in the mountains during a snowstorm."", 'They make their way on foot to a deserted mountain retreat, where they find food and shelter. And a crazy killer who wants them all dead!",Story,2
"The movie all seems to take place at night, and sweat is dripping off everyone, except in one of the rare air-conditioned apartments.",Cinematography,0
"i laughed because portia was denied', 'oh antonio. antoni. just toni. i love you', 'antoni was very greasy",Characters,1
"her loving feline pets - including Duchess and her three young kittens - are the most important residents', ""We meet such friendly characters as Amelia and Abigail Gabble {two talkative geese}, Uncle Waldo {the pair's drunken relative}, Georges Hautecourt {Madam Bonfamille's ancient but sprightly lawyer} and Napoleon and Lafayette {two dim-witted hound dogs with a hunger for the butler's rump}""",Characters,1
The sparse dreamscapes were reminiscent of Wyeth paintings and amazingly effective.,Cinematography,0
the movie is absolutely perfect in describing professional bridge players and how they go about earning a living,Story,2
"Cary Elwes brings his cheeky grinning twinkle eyed presence to this movie, and does a wonderful job.', 'Richard Lewis is hilarious as the whiny, arrogant Prince John with the ever-changing mole.', 'Roger Rees as the sleazy sheriff of Rottingham is marvellously slimy and nasty.",Characters,1
"the actors are also the business owners is a double-edged sword', 'they do a very poor job of conveying those emotions",Characters,1
"amazing long shots', 'specific for Nordic cinema",Cinematography,0
the camera work and film quality are amateur at best,Cinematography,0
"fairly creepy camera-work', 'shots of ghoulish faces are done incredibly poorly",Cinematography,0
"goofy plot elements', 'The plot is full of goofy stuff', 'these monster movies all follow a similar formula', 'this one spices things up with a bit of humor ],",Story,2
"""This is her film, but she doesn't overstep her bounds as a lead."", 'SHepherd graciously allows Robert Downey Jr. to carry much of the film', ""Masterson's natural charm pretty much coasts on its own""",Characters,1
very well done camera work (nice job Mr. Lieberman!),Cinematography,0
"there was every chance of this film being slick and witty while tackling depression head on.', 'What we get instead is poorly acted hysteria dressed up with a stereotypical try hard eighties veneer.",Story,2
"the acting, while B-class, is actually quite impressive', 'Corbin Bernsen taking the lead role and doing a good job of convincing the audience that he really is a man on the edge', 'thank Brian Yuzna for casting Ken Foree in the movie",Characters,1
excellent CGI to create the best monsters ever,Cinematography,0
I still think the directing and cinematography are excellent,Cinematography,0
"The acting is really, really good.', ""Edison Chen as the Hit-man is incredible; he proves that he isn't just any pretty face."", 'Sam Lee as the obsessed cop is also outstanding.', 'The supporting cast, in short, is excellent.",Characters,1
"The movie gets to the guts of the tension between a son and a father.', 'The core issues of parenting, communication and manhood are explored indirectly.",Story,2
"Ned aKelly is such an important story to Australians but this movie is awful.', ""It's an Australian story yet it seems like it was set in America.""",Story,2
"the only likable character is killed off and the anti-hero is blamed', 'the kindly old diner manager, and the town creep', ""the mere presence of the hero's friend somehow drags a confession out of the real killer - the leering, creepy town nut"", 'his paternal regard towards Danny is not, in fact, paternal but spousal.",Characters,1
"Vital milestones of his personal life, his sexuality, his artistic style and growth, Queen, the band remain unexplored.', 'Instead delivering a tedious montage of politely clean and vastly empty comments about an enigmatic and brilliant rock legend.",Story,2
"I was anxious to see the layers being stripped away and her psyche being slowly twisted', ""we don't know exactly what the hell she's doing half the time, what she's after, or why she's doing it"", ""Dawson does point out in the Q&A is that by the end 'revenge' scene we are pumped for retribution""",Characters,1
"Not only does it have the worst male actor ever (Sly Stallone) playing the lead role', 'Sly performing even worse than his other movies', 'he was better even in Rambo III if you watch that movie as a comedy rather than action film', ""an actor who can't act A) surprised B) sad C) anything else than his basic face""",Characters,1
"""hard to evaluate the performance of the actors that don't squeeze a single word"", 'not enough room for great camera-work",Cinematography,0
"The flashback scenes of their lives are mostly in black and white, with bits of color now and then sprinkled throughout.', 'I found it interesting that only selected items were colored in the flashback scenes, with everything else in black and white.",Cinematography,0
"realistic portrayal of a mother/daughter relationship', 'connection between Adele and Ann', 'outstanding performances of both Susan Sarandon and Natalie Portman', 'Sarandon was just the right actress to portray Adele', 'Portman was also excellent as Ann', 'sense of maturity and intelligence to the role",Characters,1
"Based on a true story of how a man ahead of his time - the great 19th century American poet and humanist Walt Whitman - made a significant contribution to how western medicine treats people with psychological problems.', ""The story of Walt's interactions with psychiatric workers, patients and townsfolk is full of drama, good humor and wisdom.""",Story,2
"a lot of special effects that seems ridiculous effects in fact ],",Cinematography,0
"This is a psychological drama about the rookie and his mentor that just happens to be about killing people.', ""I was disappointed with the action towards the end - a lot of it didn't make much sense and was unsatisfying given the buildup from the rest of the movie.""",Story,2
"no one in the movie were really trying to act rather they were just being themselves', 'the entire main cast were just playing themselves",Characters,1
"the images it conveys, both powerful and sweeping",Cinematography,0
the camera work is pretty sluggish at times,Cinematography,0
"""The cell animation, while somewhat traditional, possesses a vivid style that explosively portrays Leiji Matsumoto's great talent for character design and visual storytelling.""",Cinematography,0
"""entertaining to see some of Jan de Bont's camera work""",Cinematography,0
"The story is a real morality tale, the kind that she loved to star in.', ""The controversial topics aren't always spelled out plainly; a viewer has to pay attention and pick up on hints to catch everything that is being implied on first viewing - although everything is more or less explained in the end.""",Story,2
"City Hall takes on the politics of a city rather than country, state or any sort of major political table', 'as events unfold a mystery begins and the political aspect is kind of left in the background",Story,2
